{
  "$schema": "https://json-schema.org/draft/2020-12/schema",
  "$id": "https://github.com/tt-a1i/archify/schemas/erd.schema.json",
  "title": "Archify Entity Relationship Diagram",
  "type": "object",
  "additionalProperties": false,
  "required": [
    "schema_version",
    "diagram_type",
    "meta",
    "entities",
    "relationships"
  ],
  "properties": {
    "schema_version": {
      "const": 1
    },
    "diagram_type": {
      "const": "erd"
    },
    "meta": {
      "type": "object",
      "additionalProperties": false,
      "required": [
        "title"
      ],
      "properties": {
        "title": {
          "type": "string",
          "minLength": 1
        },
        "subtitle": {
          "type": "string"
        },
        "output": {
          "type": "string"
        },
        "animation": {
          "enum": [
            "trace",
            "none"
          ]
        },
        "visual_preset": {
          "enum": [
            "classic",
            "signal-flow",
            "blueprint",
            "editorial"
          ]
        },
        "quality_profile": {
          "enum": [
            "standard",
            "showcase"
          ]
        },
        "views": {
          "$ref": "common.schema.json#/$defs/guidedViews"
        },
        "legend": {
          "type": "object",
          "additionalProperties": false,
          "properties": {
            "mode": { "$ref": "common.schema.json#/$defs/legendMode" },
            "entries": {
              "type": "object",
              "additionalProperties": false,
              "properties": {
                "core": { "$ref": "common.schema.json#/$defs/legendEntry" },
                "reference": { "$ref": "common.schema.json#/$defs/legendEntry" },
                "junction": { "$ref": "common.schema.json#/$defs/legendEntry" },
                "external": { "$ref": "common.schema.json#/$defs/legendEntry" },
                "default": { "$ref": "common.schema.json#/$defs/legendEntry" },
                "emphasis": { "$ref": "common.schema.json#/$defs/legendEntry" },
                "security": { "$ref": "common.schema.json#/$defs/legendEntry" },
                "dashed": { "$ref": "common.schema.json#/$defs/legendEntry" },
                "exactly-one": { "$ref": "common.schema.json#/$defs/legendEntry" },
                "zero-or-one": { "$ref": "common.schema.json#/$defs/legendEntry" },
                "one-or-many": { "$ref": "common.schema.json#/$defs/legendEntry" },
                "zero-or-many": { "$ref": "common.schema.json#/$defs/legendEntry" }
              }
            }
          }
        },
        "viewBox": {
          "type": "array",
          "prefixItems": [
            {
              "type": "number",
              "minimum": 360
            },
            {
              "type": "number",
              "minimum": 360
            }
          ],
          "items": false,
          "minItems": 2,
          "maxItems": 2
        }
      }
    },
    "entities": {
      "type": "array",
      "minItems": 2,
      "maxItems": 16,
      "items": {
        "type": "object",
        "additionalProperties": false,
        "required": [
          "id",
          "name",
          "attributes",
          "column",
          "row"
        ],
        "properties": {
          "id": {
            "$ref": "common.schema.json#/$defs/id"
          },
          "name": {
            "type": "string",
            "minLength": 1,
            "maxLength": 48
          },
          "kind": {
            "enum": [
              "core",
              "reference",
              "junction",
              "external"
            ]
          },
          "attributes": {
            "type": "array",
            "minItems": 1,
            "maxItems": 12,
            "items": {
              "type": "object",
              "additionalProperties": false,
              "required": [
                "name",
                "type"
              ],
              "properties": {
                "name": {
                  "type": "string",
                  "minLength": 1,
                  "maxLength": 32
                },
                "type": {
                  "type": "string",
                  "minLength": 1,
                  "maxLength": 24
                },
                "key": {
                  "enum": [
                    "pk",
                    "fk",
                    "unique"
                  ]
                },
                "note": {
                  "type": "string",
                  "maxLength": 48
                }
              }
            }
          },
          "column": {
            "type": "integer",
            "minimum": 0,
            "maximum": 3
          },
          "row": {
            "type": "integer",
            "minimum": 0,
            "maximum": 3
          },
          "width": {
            "type": "number",
            "minimum": 96
          },
          "yOffset": {
            "type": "number"
          }
        }
      }
    },
    "relationships": {
      "type": "array",
      "minItems": 1,
      "maxItems": 24,
      "items": {
        "type": "object",
        "additionalProperties": false,
        "required": [
          "from",
          "to",
          "fromCardinality",
          "toCardinality"
        ],
        "properties": {
          "id": {
            "$ref": "common.schema.json#/$defs/id"
          },
          "from": {
            "$ref": "common.schema.json#/$defs/id"
          },
          "to": {
            "$ref": "common.schema.json#/$defs/id"
          },
          "label": {
            "type": "string",
            "maxLength": 32
          },
          "variant": {
            "$ref": "common.schema.json#/$defs/variant"
          },
          "fromCardinality": {
            "enum": [
              "exactly-one",
              "zero-or-one",
              "one-or-many",
              "zero-or-many"
            ]
          },
          "toCardinality": {
            "enum": [
              "exactly-one",
              "zero-or-one",
              "one-or-many",
              "zero-or-many"
            ]
          },
          "fromField": {
            "type": "string",
            "minLength": 1,
            "maxLength": 32
          },
          "toField": {
            "type": "string",
            "minLength": 1,
            "maxLength": 32
          },
          "fromSide": {
            "enum": [
              "left",
              "right",
              "top",
              "bottom"
            ]
          },
          "toSide": {
            "enum": [
              "left",
              "right",
              "top",
              "bottom"
            ]
          },
          "route": {
            "enum": [
              "auto",
              "straight",
              "orthogonal-h",
              "orthogonal-v"
            ]
          },
          "via": {
            "type": "array",
            "items": {
              "$ref": "common.schema.json#/$defs/point"
            }
          },
          "labelAt": {
            "$ref": "common.schema.json#/$defs/point"
          },
          "labelDx": {
            "type": "number"
          },
          "labelDy": {
            "type": "number"
          },
          "labelSegment": {
            "type": "integer",
            "minimum": 0
          },
          "width": {
            "type": "number",
            "minimum": 0.5
          }
        }
      }
    },
    "cards": {
      "$ref": "common.schema.json#/$defs/cards"
    }
  }
}
